{
  "schema": "gentle-ai.work-advance/v2",
  "contract": "gentle-ai.work-advance/v2",
  "previousRevision": "sha256:aaaaaaaaaaaaaaaaaaaaaaaaaaaaaaaaaaaaaaaaaaaaaaaaaaaaaaaaaaaaaaaa",
  "status": {
    "schema": "gentle-ai.work-status/v1",
    "contract": "gentle-ai.work-status/v1",
    "workRunId": "work-advance-v2-checkpoint-fixture",
    "revision": "sha256:bbbbbbbbbbbbbbbbbbbbbbbbbbbbbbbbbbbbbbbbbbbbbbbbbbbbbbbbbbbbbbbb",
    "publicState": "needs_your_decision",
    "routeDecision": "direct_inline",
    "routePhase": "implementation_selected",
    "implementationRoute": "direct_inline",
    "verification": {
      "outcome": "pending",
      "resultRefs": []
    },
    "deliveryIntentRef": "sha256:dddddddddddddddddddddddddddddddddddddddddddddddddddddddddddddddd"
  },
  "verificationDecision": {
    "schema": "gentle-ai.verification-decision-prompt/v1",
    "contract": "gentle-ai.work-verification-decide/v1",
    "operation": "decide",
    "promptRef": "sha256:373d6d710517babd9764f55b9715f067187b889352a7571c04f4a045f0d9905c",
    "workRunId": "work-advance-v2-checkpoint-fixture",
    "expectedRevision": "sha256:bbbbbbbbbbbbbbbbbbbbbbbbbbbbbbbbbbbbbbbbbbbbbbbbbbbbbbbbbbbbbbbb",
    "forecastRef": "sha256:cccccccccccccccccccccccccccccccccccccccccccccccccccccccccccccccc",
    "assumptionsRef": "sha256:cccccccccccccccccccccccccccccccccccccccccccccccccccccccccccccccc",
    "cost": "long",
    "choices": [
      "run",
      "defer",
      "reduce_scope"
    ]
  }
}
